,Case Number,Year,Type,Country,Area,Location,Activity,Sex,Injury,Fatal,Source,Month
2321,1992.07.08.a,1992,Unprovoked,BRAZIL,Maranhão,"Praia da Marcela, São Marcos Bay",Surfing,M,"Lower leg bitten, surgically amputated",N,M. Szpilman,jul
2322,1992.06.28.b,1992,Unprovoked,BRAZIL,Pernambuco,Piedade,Swimming,M,FATAL,Y,D .Duarte,jun
2323,1992.06.28.a,1992,Unprovoked,REUNION,Saint-Paul,Cap de la Marianne,Surfing,M,FATAL,Y,G. Van Grevelynghe,jun
2324,1992.06.19,1992,Unprovoked,VANUATU,Malampa Province,"Port Sandwich, Malakula",Swimming,F,Right leg was bitten above and below the knee and an artery was punctured,N,"A. Rush; R. D. Weeks, GSAF; Otago Daily Times, 6/20/1992",jun
2325,1992.06.17,1992,Boat,JAPAN,Ehime Prefecture,"1.5 km north of Igata-cho, 60 km south of Matsyama",Preparing to fish for jack-mackerel,,"No inujury to occupant. Shark bit boat repeatedly, leaving  2 teeth in the bottom keel of the boat",N,"K. Nakaya; Orlando Sentinel, 6/18/1992, p. A3",jun
2326,1992.06.00,1992,Unprovoked,REUNION,Saint-Paul,,Diving,,Survived,N,G. Van Grevelynghe,jun
2327,1992.05.31,1992,Invalid,USA,North Carolina ,Wreck of the U-352 ,Scuba diving ,M,Disappeared. His ripped dive jacket was recovered,Y,"Charlotte Observer, 6/24/1992, p.1C & 8/8/1992, p.2C",may
2328,1992.05.22,1992,Unprovoked,REUNION,Saint-Joseph,Lieu-dit Cayenne,Surfing,M,FATAL,Y,G. Van Grevelynghe,may
2329,1992.05.00,1992,Unprovoked,MEXICO,Mexico / Caribbean Sea,Isla Mujeres,Scuba diving & filming,M,"Fingers, hand & arm bitten",N,"T. Allen, p.238",may
2330,1992.04.24,1992,Unprovoked,NEW ZEALAND,Antarctic Ocean,"Meteorologic Station on Campbell Island, 370 nautical miles south of New Zealand",Snorkeling,M,"Right forearm severed, left forearm lacerated & broken",N,"M. Fraser; R. Weeks, GSAF",apr
2331,1992.04.09,1992,Unprovoked,SOUTH AFRICA,Eastern Cape Province,Nahoon,Surfing,M,Punctures & lacerations on lower leg,N,"G. Harmer; M. Levine, GSAF",apr
2332,1992.03.28,1992,Unprovoked,USA,Hawaii,"Cannons, at Ha'ena on the north shore of Kaua'i Island","Surfing, paddling seawards",F,"Foot bitten, crescent of bitemarks in both sides of board",N,"G. Ambrose, pp.18-23; J. Borg, p.81; L. Taylor (1993), pp.112-113",mar
2333,1992.03.10,1992,Unprovoked,AUSTRALIA,Victoria,Point Lonsdale,Surfing,M,"Right thigh, back & hand lacerated",N,"Herald Sun, 1/7/1993; A. Sharpe, p.116",mar
2334,1992.03.08.c,1992,Unprovoked,JAPAN,Ehime Prefecture,Matsuyama,Hookah diving for pen shells ,M,"FATAL, body not recovered",Y,"K. Nakaya; Orlando Sentinel, 3/20/1992, p.A10 & 6/18/1992, p. A3",mar
2335,1992.03.08.b,1992,Boat,JAPAN,Ehime Prefecture,"Nagahama-cho, 40 km southwest of Matsuyama ","Fishing for yellowtail, Seriola quinqueradiata",,No injury to boat or occupant,N,K. Nakaya,mar
2336,1992.03.08.a,1992,Unprovoked,USA,Oregon,"Winchester Bay, Douglas County",Surfing (sitting on his board),M,"Left shoulder & side bitten, board broken",N,"R. Collier, pp.130-132; M.  Marks",mar
2337,1992.02.19,1992,Unprovoked,USA,Hawaii,"Leftovers, near Waimea Bay, O'ahu",Body boarding,M,FATAL Disappeared. His board washed ashore next morning with crescent-shaped piece missing and serrated toothmarks of a shark,Y,"J. Borg, pp.80-81; L. Taylor (1993), pp.112-113. Note: Hawaii Department of Land and Natural Resources lists date as 2/1/1992",feb
2338,1992.02.14,1992,Unprovoked,JAPAN,Ehime Prefecture,Matsuyama,Diving for pen shells,M,"No injury, steel diving helmet bitten 3 times",N,K. Nakaya,feb
2339,1992.02.09,1992,Invalid,AUSTRALIA,Tasmania,"Clifton Beach, southwest of Hobart",Surfing,M,"No injury, shark allegedly took his surfboard & slashed his wetsuit. Shark involvement questionable",N,"C. Black, GSAF; Advertiser, 2/11/1992, p.2; ",feb
2340,1992.01.29.b,1992,Unprovoked,REUNION,La Saline-les-Bains,Revine-3-Bassins,Spearfishing,M,Survived,N,G. Van Grevelynghe,jan
2341,1992.01.29.a,1992,Unprovoked,AUSTRALIA,New South Wales,Tweed Heads,Boogie boarding,M,Right leg lacerated,N,"Advertiser, 1/30/1992, p.7 & 2/1/1992, p.4",jan
2342,1992.01.23,1992,Unprovoked,SOUTH AFRICA,KwaZulu-Natal,Isipingo,Swimming ,M,Right foot lacerated,N,"G. Cliff, NSB",jan
2343,1992.01.08,1992,Unprovoked,SOUTH AFRICA,KwaZulu-Natal,Sheffield Beach,Spearfishing,M,Left cheek lacerated,N,"A. Gifford, GSAF",jan
2344,1992.01.06,1992,Unprovoked,MAURITIUS,,Mahebourg,Fishing,M,Survived,N,D. deSpeville,jan
2345,1992.01.03,1992,Unprovoked,JAPAN,Ehime Prefecture,Matsuyama,,M,Survived,N,K. Nakaya,jan
2346,1992.01.00,1992,Invalid,JAPAN,Sea of Japan,Kanazawa?,,,Survived. questionable incident,N,K. Nakaya,jan
2348,1991.12.04,1991,Unprovoked,USA,California,"Shelter Cover, north of Fort Bragg, Shelter Cove, Mendocino County",Hookah diving for sea urchins,M,"No injury, shark became tangled in hose & towed him 100'",N,"R. Collier, pp.129-130; Mark Marks; S. Waterman     ",dec
2349,1991.11.26.b,1991,Unprovoked,USA,Hawaii,"Olowalu, Maui",Snorkeling,F,"FATAL, right leg at hip, left leg and right forearm severed  ",Y,"J. Borg, pp.1-3; A. MacCormick, p.151; L. Taylor (1993), pp.112-113",nov
2350,1991.11.26.a,1991,Unprovoked,USA,Hawaii,"Olowalu, Maui",Snorkeling,F,Right calf abraded,N,"J. Borg, p.80; A. MacCormick, p.151; L. Taylor (1993), pp.112-113",nov
2351,1991.11.19,1991,Unprovoked,USA,Hawaii,"Maliko Point, Maui","Fishing from rocks, swept out to sea by large wave & treading water",M,"Body not recovered, shorts found indicating shark bite on left side",Y,"J. Borg, pp.79-80; L. Taylor (1993), pp.110-111",nov
2352,1991.11.14,1991,Provoked,USA,Florida,Near Port Canaveral Coast Guard Base,Fishing,M,Hand bitten as he was cleaning hooked shark PROVOKED INCIDENT,N,"D.E. Owens, Orlando Sentinel, 11/15/1991",nov
2353,1991.11.00,1991,Unprovoked,AUSTRALIA,Western Australia,"Backbeach, Halls Head",Boogie boarding,M,Calf scratched & chunk bitten from board,N,"A. Sharpe, pp.135-136",nov
2354,1991.10.12,1991,Unprovoked,USA,Florida,"Melbourne Beach, Brevard County",Surfing,M,Right foot & ankle lacerated,N,"Orlando Sentinel, 10/13/1991",oct
2355,1991.10.05,1991,Unprovoked,USA,California,"Horseshoe Reef, Scott Creek, Davenport, Santa Cruz County",Surfing,M,"Arm, shoulder & back bitten",N,"R. Collier, pp.126-128 ; Orlando Sentinel, 10/6/1991, p.A8 & 10/10/ 1991, p.A8 ",oct
2356,1991.09.19,1991,Invalid,BAHAMAS,,Bimini,Spearfishing,M,"Initally reported as a shark attack, forensic examination concluded cause of death was drowning",Y,"E. Pace, FSAF; Sun Sentinel, 9/22/1991, p.3B",sep
2357,1991.09.08,1991,Unprovoked,AUSTRALIA,South Australia,"Snapper Point, Aldinga Beach, Adelaide",Scuba diving,M,FATAL,Y,"Advertiser, 1/31/1992, p.5; A. Sharpe, pp.127-128 ",sep
2358,1991.08.30,1991,Provoked,AUSTRALIA,Queensland,"On board the Japanese longline trawler Fukuya No.38, 100 nm northeast of Brisbane",Finning the shark that bit him,M,"Shark bit his arm, nearly severing it PROVOKED INCIDENT",N,"A. Sharpe, pp.107-108",aug
2359,1991.08.26,1991,Unprovoked,USA,South Carolina,"Myrtle Beach, Horry County",Swimming,M,Deep cuts on lower leg,N,"Charlotte Observer, 8/27/1991, p.1B",aug
2360,1991.08.12,1991,Unprovoked,USA,Florida,"Vero Beach, Indian River County",Wading,F,Bite to left thigh & calf,N,"Vero Beach Press Journal, 8/13/1991,    E. Pace, FSAF",aug
2361,1991.08.09,1991,Provoked,USA,Florida,Florida Bay,Fishing,M,Laceration to right forearm PROVOKED INCIDENT,N,"Miami Herald, 8/10/1991, p.2B",aug
2362,1991.07.30,1991,Boat,ITALY,Ligurian Sea,"Portofino, 20 miles offshore, Tigullio Bay, Santa Margherita Ligure (Liguria)",Canoeing,F,No Injury to occupant; canoe bitten,N,"Stars & Stripes, 8/5/1991, p.8; A. De Maddalena; Graffione (1991), Fergusson (1996), Angela et al. (1997)",jul
2363,1991.07.27,1991,Unprovoked,USA,Florida,"John Pennekamp Marine Park, Monroe County",Snorkeling,M,Arm bitten,N,"Miami Herald, 7/31/1991",jul
2364,1991.07.18,1991,Unprovoked,USA,Florida,150 miles from Crystal River,Swimming from makeshift raft  to life vest after fishing boat sank,M,Punctures in lower abdomen & groin ,N,"Orlando Sentinel, 7/23/1991, p.A1",jul
2365,1991.07.07,1991,Unprovoked,USA,Florida,"South Miami Beach, Dade County",Swimming,M,Arm bitten,N,"E. Pace, FSAF",jul
2366,1991.07.01.b,1991,Unprovoked,REUNION,L'Etang-Salé,"Ravine des Sables, Saint Leu",Surfing,M,Left arm severed,N,"R.D. Weeks, GSAF, p.303; G. Van Grevelynghe",jul
2367,1991.07.01.a,1991,Unprovoked,USA,California,"8.5 miles south of Ano Nuevo State Reserve, Davenport County",Surfing,M,"Forearm, upper thigh, knee & ankle lacerated",N,"R. Collier, pp.124-126 ; San Jose Mercury, 7/4/1991; Orlando Sentinel, 7/4/1991, p.A21; 10/6/1991, p.A22
  ",jul
2368,1991.07.00,1991,Unprovoked,USA,Virginia,"Croatan Beach, Virginia Beach, ",Boogie boarding,M,Severe laceration to foot,N,"Virginia Beach Beacon, 10/15/1991",jul
2369,1991.06.29,1991,Unprovoked,HONG KONG,,"Basalt Island, 9km from Silverstrand",,M,FATAL,Y,J. Wong,jun
2370,1991.06.28,1991,Unprovoked,HONG KONG,Kowloon Peninsula,Sai Kung,Fishing,M,"FATAL, right arm severed  ",Y,"A. MacCormick, pp.103-104 & 235",jun
2371,1991.06.26,1991,Unprovoked,USA,Florida,"Jacksonville Beach, Duval County",Surfing,M,Hand bitten,N,"Miami Herald, 6/28/1991, p.5B",jun
2372,1991.06.07.b,1991,Unprovoked,USA,Florida,"Tampa Bay, Hillsborough County",Swimming behind sailboat,M,"Left ankle, calf, thigh and abdomen bitten",N,"Orlando Sentinel; 6/9/1991, p.B3; Ocala Star-Banner, 6/8/1991; St. Petersburg Times, 11/28/1991 ",jun
2373,1991.06.07.a,1991,Unprovoked,HONG KONG,Port Shelter,"Silverstrand Beach, near Hung Hau ",Swimming ,F,Abdomen bitten & leg severed  FATAL,Y,"Sunday Mail, 6/9/91, p.28",jun
2374,1991.05.26,1991,Unprovoked,USA,Hawaii,"Ma'ili Beach, O'ahu",Sitting on surfboard,M,Right calf bitten,N,"J. Borg, p.79; L. Taylor (1993), pp.110-111",may
2375,1991.05.19,1991,Unprovoked,SOUTH AFRICA,Western Cape Province,Gordons Bay,Scuba diving,M,"No injury, tank scratched by shark",N,"M. Levine, GSAF",may
2376,1991.04.24,1991,Provoked,BRAZIL,Pernambuco,"Praia de Pau Amarelo, Recife",Fishing,,2 fingers severed by netted shark PROVOKED INCIDENT,N,M. Szpilman,apr
2377,1991.04.16.b,1991,Provoked,USA,Maryland,Baltimore Aquarium,Diving,,Minor injury by captive shark PROVOKED INCIDENT,N,"Washington Post, 4/20/1991",apr
2378,1991.04.16.a,1991,Unprovoked,USA,Florida,"South of Ponce Inlet, New Smyrna Beach, Volusia County","Surfing, collided with shark",M,Right thigh,N,"Orlando Sentinel, 4/18/199, p.B3",apr
2379,1991.04.03,1991,Unprovoked,USA,Hawaii,"One'ula Beach Park, 'Ewa Beach, O'ahu",Sitting on surfboard,M,Deep lacerations to calf & ankle,N,"J. Borg, p.79; L. Taylor (1993), pp.110-111",apr
2380,1991.03.03,1991,Unprovoked,AUSTRALIA,New South Wales,Bass Point,Scuba diving,M,Lacerations to arm & leg,N,"Sunday Advertiser, 3/5/1991, p.2",mar
2381,1991.02.24,1991,Unprovoked,USA,Oregon,"Neskowin, Tillamook County",Surfing,M,Calf lacerated & board bitten,N,"R. Collier, pp.122-123",feb
2382,1991.02.12,1991,Unprovoked,SOUTH AFRICA,Western Cape Province,Millers Point,Spearfishing,M,Foot & swim fin bitten,N,"M. Levine, GSAF",feb
2383,1991.01.19,1991,Unprovoked,AUSTRALIA,Queensland,Mermaid Waters,Swimming,M,"Hands, legs & buttocks lacerated",N,"Sunday Mail, 1/20/1991, p.1",jan
2384,1991.01.09,1991,Unprovoked,AUSTRALIA,Western Australia,Scarborough,Surf-skiing,M,"No injury, shark brushed ski",N,"Courier-Mail, 1/10/1991, p.5",jan
2385,1991.01.00,1991,Unprovoked,AUSTRALIA,Queensland,Pelican Banks near Gladstone,Surfing (or sailboarding),M,Survived,N,"Courier-Mail, 3/25/1991, p.4",jan
2386,1990.12.26,1990,Invalid,SOUTH AFRICA,Eastern Cape Province,Port Elizabeth,,M,Survived,N,Unverified report,dec
2387,1990.11.28,1990,Unprovoked,AUSTRALIA,Queensland,Nerang River,Swimming ,M,"Abdomen, hip, leg & arm bitten",N,"Herald Sun, 11/30/1990, p.34",nov
2388,1990.11.03,1990,Unprovoked,USA,California,"Monastery Beach, Carmel Bay, Monterey County",Scuba diving (but on surface),F,Leg bitten,N,"R. Collier, p.122",nov
2389,1990.11.01,1990,Unprovoked,USA,Florida,"Spanish River Park Beach, Palm Beach County",Surfing,M,"Ear, shoulder, arm, wrist & ear injured",N,"Palm Beach Post, 11/3/1990; Miami Herald, 11/2/1990  ",nov
2390,1990.10.30.b,1990,Unprovoked,USA,Florida,"Melbourne Beach, Brevard County",Surfing,M,"Hand & wrist bitten, tooth fragments in wound",N,"S. Jacobson, Orlando Sentinel, 11/1/1990, p. B1; St. Petersburg Times, 11/1/1990; Miami Herald, 11/1/1990",oct
2391,1990.10.30.a,1990,Unprovoked,USA,Florida,"Indialantic, Brevard County",Surfing,M,Cuts on left foot ,N,"S. Jacobson, Orlando Sentinel, 11/1/1990 ",oct
2392,1990.10.27,1990,Unprovoked,AUSTRALIA,Queensland,Mermaid Waters,Swimming,M,Buttocks & hip bitten,N,"Sunday Mail (QLD), 10/28/1990, p.1",oct
2393,1990.10.25,1990,Unprovoked,AUSTRALIA,South Australia,Goolwa Beach,Surfing,M,Lacerations to foot,N,"The News, 10/26/1990",oct
2394,1990.10.20,1990,Unprovoked,USA,Florida,"North end of County Beach, Palm Beach County",Surfing,M,Wrist bitten,N,"Palm Beach Post, 10/22/1990  ",oct
2395,1990.10.15,1990,Unprovoked,USA,Hawaii,"Hanalei Point, Kaua'i",Surfing,M,"No Injury, board bitten",N,"G.. Filtzer; G. Ambrose, pp.8-17; J. Borg, p.64",oct
2396,1990.10.12,1990,Unprovoked,USA,Florida,"Stuart Beach, Martin County",Surfing,M,Superficial injuries to left foot & ankle,N,"S.L. Jackson, Palm Beach Post, 10/13/1990  ",oct
2397,1990.09.15,1990,Unprovoked,SOUTH AFRICA,Western Cape Province,Oudekraal,Spearfishing,M,Right hand lacerated,N,"P. v.d. Walt; G. Cliff, NSB",sep
2398,1990.09.08,1990,Unprovoked,USA,California,"Russian Gulch, Jenner, Sonoma County","Free diving / spearfishing, from paddleboard & floating on the surface",M,"Shark rammed & overturned paddleboard, knocking him into water & bit his head, lacerating his face & neck",N,R. Collier pp.120-121,sep
2399,1990.09.05,1990,Boat,USA,California,"Trinidad State Beach, Humboldt County",Kayaking,M,"No injury, kayak capsized",N,"R. Collier, pp118-119          ",sep
2400,1990.08.30,1990,Invalid,USA,Florida,"Juno Beach / North Palm Beach, Palm Beach County",SCUBA diving,M,"Disappeared, body recovered with large bite on thigh",Y,"Miami Herald, 9/6/1990; Orlando Sentinel, 9/7/1990, p.B4",aug
2401,1990.08.28,1990,Unprovoked,USA,California,"Trinidad Head, Humboldt County",Surfing,M,4 punctures on leg & board bitten,N,"R. Collier, pp.116-118",aug
2402,1990.08.19.b,1990,Unprovoked,USA,Texas,"Mustang Island, Nueces County",Surfing,M,Minor cuts to foot,N,"Dallas Morning News, 8//22/1990",aug
2403,1990.08.19.a,1990,Unprovoked,USA,Texas,"Near Port Aransas, Nueces County",Wade fishing,M,Minor injury,N,"Dallas Morning News, 8//22/1990",aug
2404,1990.07.22,1990,Unprovoked,USA,Texas,"Mustang Island State Park, Nueces County",Wading,F,10-inch laceration to right foot,N,"Paris News, 7/23/1990",jul
2405,1990.07.08,1990,Unprovoked,USA,Florida,"Perdido Key near the Florida Panhandle, Escambia County",Surfing,M,Minor injury to left ankle & foot,N,"Orlando Sentinel, 7/8/1990, p.B.1",jul
2406,1990.06.24,1990,Unprovoked,SOUTH AFRICA,Western Cape Province,Mossel Bay,Scuba diving (but on surface),F,"FATAL, thigh bitten  ",Y,"A Gifford, G. Cliff, GSAF",jun
2407,1990.06.23,1990,Unprovoked,BAHAMAS,,Bimini,Spearfishing,M,Left forearm bitten,N,"Miami Herald, 6/25/1990",jun
2408,1990.05.13,1990,Provoked,SOUTH AFRICA,KwaZulu-Natal,Protea Reef,Fishing,,"No injury to occupants, hooked shark freed itself, then rammed stern of boat PROVOKED INCIDENT",N,"G. Charter, GSAF",may
2409,1990.05.10,1990,Unprovoked,AUSTRALIA,Queensland,Outer Barrier Reef near Port Douglas,Snorkeling,F,Lacerations,N,"Courier-Mail, 5/11/1990, p.1",may
2410,1990.05.10,1990,Unprovoked,AUSTRALIA,Queensland,Outer Barrier Reef near Port Douglas,"Snorkeling, possibly holding a fish",M,Lacerations,N,"Courier-Mail, 5/11/1990, p.1",may
2411,1990.05.06,1990,Unprovoked,SOUTH AFRICA,Eastern Cape Province,Cintsa East,Resting on surfboard,M,Thigh severely lacerated,N,"R. Forrester, M. Levine, GSAF",may
2412,1990.04.14,1990,Unprovoked,SOUTH AFRICA,Eastern Cape Province,Cape Recife,Lying on surfboard & paddling,M,Leg bitten,N,M. Smale,apr
2413,1990.04.09,1990,Unprovoked,AUSTRALIA,Queensland,Greenmount Beach,Surfing,M,"Lacerations & abrasions, board bitten in half",N,"Herald, 4/10/1990, p.4 & 4/11/1990, p.1",apr
2414,1990.04.08,1990,Unprovoked,AUSTRALIA,Queensland,"Dingo Reef, 80 nm off Townsville",Free diving for trochus,M,Presumed FATAL,Y,"Courier-Mail, 4/12/1990, p.5",apr
2415,1990.04.07,1990,Unprovoked,AUSTRALIA,Queensland,Fingal Beach,Surfing,M,"No injury, board broken in two",N,"Herald, 4/10/1990, p.4",apr
2416,1990.04.06,1990,Unprovoked,AUSTRALIA,Queensland,Fingal Beach,Surfing,M,"No injury, board bitten",N,"Herald, 4/10/1990, p.4",apr
2417,1990.04.01,1990,Unprovoked,USA,Hawaii,"Silver (Silva) Channels, Waialua, O'ahu",Sitting on surfboard,M,"Ankle lacerated, lower left leg severely abraded ",N,"J. Borg, p.79; L. Taylor (1993), pp.110-111",apr
2418,1990.03.24,1990,Unprovoked,FIJI,Laucala Island,,Swimming,M,Lacerations to right leg,N,"The News, 3/27/1990, p.6",mar
2419,1990.03.05,1990,Unprovoked,REUNION,Sainte-Marie,Baie de la Mare,Surfing,M,Survived,N,G. Van Grevelynghe,mar
2420,1990.02.17,1990,Unprovoked,USA,Hawaii,"Mokapu, Kane'ohe Marine Air Corps Station, O'ahu",Scuba diving & spearfishing,M,Right arm severed  FATAL,Y,"J. Borg, pp.78-79; L. Taylor (1993) pp.110-111",feb
2421,1990.02.05,1990,Unprovoked,USA,Florida,"Monster Hole, Sebastian Inlet, Indian River County",Board sailing,M,Foot bitten,N,"Orlando Sentinel, Feb 9, 1990. pg. B.3",feb
2422,1990.01.12,1990,Unprovoked,USA,California,"Montera Beach, San Mateo County",Surfing (sitting on his board),M,"No injury, board bitten",N,"J. McCosker & R.N. Lea; R. Collier, p. 116 ; A. MacCormick, p.67",jan
2424,1989.12.19,1989,Provoked,USA,Hawaii,"90 miles east of Hilo, Hawai'i",On board 51' fishing vessel One Ki,M,Left leg & foot bitten  by shark brought onboard. PROVOKED INCIDENT,N,"J. Borg, p.78; L. Taylor (1993), pp.108-109",dec
2425,1989.12.03,1989,Unprovoked,AUSTRALIA,Northern Territory,Gove Peninsula near Darwin,,M,"No details, ""recovering in Darwin Hospital""",UNKNOWN,"Courier-Mail, 12/6/1989",dec
2426,1989.12.02,1989,Invalid,AUSTRALIA,Queensland,Fraser Island,Swimming,M,"Swept out to sea, feared taken by shark",Y,"The Advertiser, 12/4/1989, p.2",dec
2427,1989.11.22,1989,Unprovoked,AUSTRALIA,Victoria,Kilcunda,Surfing,M,Thigh bitten,N,"Courier-Mail, 11/24/1989, p.3; J. West, ASAF",nov
2428,1989.11.18,1989,Unprovoked,SOUTH AFRICA,Western Cape Province,Melkbosstrand,Free diving & spearfishing,M,FATAL,Y,"M. Levine, GSAF",nov
2429,1989.11.12,1989,Invalid,USA,Hawaii,"Ehukai Beach Park, Sunset Beach, O'ahu","Wading, knocked down & swept away by large waves",M,Lower porton of body recovered 3 days later. Note: rare sighting of shark made at same beach on 11-5-1989 ,Y,"J. Borg, p.78; L. Taylor (1993), pp.108-109",nov
2430,1989.11.02,1989,Unprovoked,AUSTRALIA,Queensland,Mermaid Waters,Swimming in canal,M,Left ankle broken & lacerated,N,"Courier-Mail, 11/7/1989, p.3",nov
2431,1989.10.29.R,1989,Unprovoked,AUSTRALIA,Northern Territory,Edith Falls,Swimming,F,Puncture marks to right calf,N,"Sunday Mail, 10/29/1989",oct
2432,1989.10.22,1989,Unprovoked,AUSTRALIA,Tasmania,Shelly Point ,Surfing,M,"No injury, board bitten",N,"Hobart Mercury, 10/23/1989, p.1; C. Black, pp 163-167",oct
2433,1989.10.14,1989,Invalid,USA,Hawaii,"Kahe Point, O'ahu",Scuba diving,M,"Disappeared 15 minutes into shallow dive. Decapitated body minus arm found by divers the following morning, then shark appeared and consumed most of remains",Y,"Washington Post, 10/17/1989, J. Borg, pp.77-78; L. Taylor (1993), pp.108-109",oct
2434,1989.10.11,1989,Unprovoked,USA,Texas,Surfside Beach,Surfing,M,Foot & leg bitten,N,"Austin American Statesman, 10/13/1989, p.B6",oct
2435,1989.10.08,1989,Invalid,USA,North Carolina,"Between Wrightsville Beach & Carolina Beach, New Hanover County",Diving,M,FATAL,Y,"C. Creswell, GSAF & Search & Rescue diver, New Hanover County; F. Schwartz ",oct
2436,1989.10.01,1989,Unprovoked,AUSTRALIA,Victoria,"Surfers Point, Phillip Island",Surfing,M,No details,UNKNOWN,"J. West, ASAF",oct
2437,1989.09.17,1989,Unprovoked,SOUTH AFRICA,Western Cape Province,"Smitswinkel, False Bay",Free diving,M,Chest lacerated,N,"G.v.Niekerk,  C. Walker, M.Levine, GSAF",sep
2438,1989.09.13,1989,Provoked,USA,Florida,"Gulf of Mexico, 22 miles from Pensacola","Fishing, stepped on hooked shark's head",M,Bitten by hooked shark PROVOKED INCIDENT,N,"Miami Herald, 9/15/1989",sep
2439,1989.09.10,1989,Boat,USA,California,"Off Palos Verdes Estates, Los Angeles",Observing a shark feeding on a carcass of a humpback whale,,No injury to occupants. Shark bit boat's swim step & repeatedly pushed the boat away whenever if came within 4 to 5 m of the whale carcass,N,R. Collier,sep
2440,1989.09.09.b,1989,Unprovoked,USA,California,"Southeast Farallon Island, Farallon Islands",Hookah diving for abalone (descending),M,Leg bitten,N,"R. Collier, pp.110-112      ",sep
2441,1989.09.09.a,1989,Unprovoked,USA,North Carolina,"Salvo, Dare County",Surfing,M,Non-fatal,N,"C. Creswell, GSAF",sep
2442,1989.09.03,1989,Provoked,USA,California,24 km off Santa Catalina Island in the Channel Islands,Filming 5' blue shark,M,Hand  & both arms bitten   PROVOKED INCIDENT,N,"R. Collier, p. xxvi;  Orlando Sentinel, 9/6/1989, p.3A",sep
2443,1989.08.29,1989,Provoked,AUSTRALIA,Queensland,SeaWorld Theme Park,Feeding fish,M,Left leg bitten by captive shark                   PROVOKED INCIDENT,N,"The Canberra Times, 9/1/1989",aug
2444,1989.08.22.b,1989,Unprovoked,USA,Florida,"St Augustine, St Johns County",Swimming,M,3 wounds on left hand,N,"Orlando Sentinel, 8/24/1989. p.B1",aug
2445,1989.08.22.a,1989,Unprovoked,SOUTH AFRICA,Western Cape Province,Mossel Bay,Surfing,M,Multiple Injuries,N,"N.v.Broembsen; M. Levine, GSAF",aug
2446,1989.08.13,1989,Unprovoked,AUSTRALIA,New South Wales,Lennox Head,Surfing,M,"No injury, shark took chunk out of surfboard",N,"Sydney Morning Herald, 8/14/1989, p.3; Courier Mail, 8/19/1989, p.2",aug
2447,1989.08.09,1989,Unprovoked,BAHAMAS,Great Exuma Island,Highborn Cay,Spearfishing,F,Severe hand and arm injuries; right hand surgically amputated,N,"Orlando Sentinel, 8/10/1989, pp B3 & B5; Palm Beach Post, 8/15/1989 
",aug
2448,1989.08.06.R,1989,Provoked,AUSTRALIA,Queensland,Moreton Bay,Fishing for sharks,M,Laceration to arm  PROVOKED INCIDENT,N,"Sunday Mail, 8/6/1989",aug
2449,1989.07.27,1969,Invalid,BERMUDA,,,Scuba diving,M,FATAL,,"LA Times, 7/28/1989",jul
2451,1989.07.19,1989,Unprovoked,REUNION,Sainte-Suzanne,Temple Tamoule,Surfing,M,FATAL,Y,"Clicanoo, le journal  de l'Ile de la Réunion",jul
2452,1989.07.14,1989,Unprovoked,USA,Florida,"Cocoa Beach, Brevard County",Surfing,M,5-inch gash on left leg,N,"Orlando Sentinel, 7/17/1989",jul
2453,1989.07.07,1989,Unprovoked,USA,Texas,"Sargent Beach, Matagorda County",Playing ,F,Leg bitten,N,"Austin American Statesman, 7/11/1989, B4 & 10/13/1989, p.B6",jul
2454,1989.06.29,1989,Unprovoked,USA,Hawaii,"Anahola, Kaua'i",Fell off surfboard 20' from shore,M,Foot & ankle severely bitten,N,"J. Borg, p.77; L. Taylor (1993), pp.108-109",jun
2455,1989.06.17,1989,Unprovoked,USA,Louisiana,40 miles off Cocodrie,Spearfishing,M,Puncture wounds & lacerations to both legs,N,"The Advocate (Baton Rouge, La.), 6/21/1989",jun
2456,1989.06.06,1989,Unprovoked,ITALY,Tuscany,"Marinella, between Punta Blanca & Marine del Carrara ",Windsurfing (urinating on his board),M,Upper right thigh bitten,N,"I. Fergusson, MEDSAF",jun
2457,1989.06.05,1989,Unprovoked,SOUTH AFRICA,Eastern Cape Province,Jeffreys Bay,Surfing,M,"No injury, board bitten",N,"R. Jacobs, R. Joseph; M. Levine, GSAF ",jun
2458,1989.06.03,1989,Unprovoked,SOUTH AFRICA,Eastern Cape Province,Gonubie,Free diving,M,Forearm bitten,N,"M. Levine, L. Krouse, P. Sachs, GSAF",jun
2459,1989.06.00,1989,Invalid,JAPAN,Sea of Japan,,,M,"Doubtful incident, needs investigation",N,K. Nakaya,jun
2460,1989.04.23,1989,Unprovoked,USA,Florida,"Loggerhead Park, Juno Beach, Palm Beach County",Swimming,M,Right calf bitten,N,"Palm Beach Post, April 27, 1989   ",apr
2461,1989.04.12,1989,Unprovoked,USA,Washington,"Pacific Beach, Grays Harbor County",Surfing (lying prone on his board),M,Forearm bitten,N,"R. Collier, p.110; J. McCosker & R.N. Lea      ",apr
2462,1989.04.09,1989,Boat,USA,California,"Monterey Bay, Monterey County",,,No injury to occupants. Shark rammed boat 4 times,N,R. Collier,apr
2463,1989.04.03,1989,Unprovoked,USA,Hawaii,"Ho'okipa Beach, Pa'ia, Maui",Paddling on surfboard,M,Calf lacerated,N,"J. Borg, p.77; L. Taylor (1993), pp.108-109",apr
2464,1989.04.00,1989,Unprovoked,USA,Hawaii,"Kekaha Beach, Kaua'i",Paddling on surfboard,M,"Board rammed by shark, skegs knocked loose & 5' strip of fiberglass torn off, thigh scratched by sharks teeth",N,"J. Borg, p.77; L. Taylor (1993), pp.108-109",apr
2465,1989.03.09,1989,Unprovoked,AUSTRALIA,South Australia,"Waitpinga Beach, near Victor Harbor, Encounter Bay",Surfing,M,Thigh bitten FATAL,Y,"Courier-Mail, 3/11/1989, p.5;  J. West, ASAF",mar
2466,1989.03.04,1989,Boat,AUSTRALIA,Western Australia,Near Broome in Roebuck Bay,Kayaking,M,"No injury, but the kayak was bitten by the shark",N,"K. Courtenay; T. Peake, GSAF",mar
2467,1989.02.19,1989,Provoked,SOUTH AFRICA,Western Cape Province,,Fishing,M,Thigh lacerated & abraded  PROVOKED INCIDENT,N,"Sunday Times, 2/19/1989",feb
2468,1989.02.15,1989,Unprovoked,SOUTH AFRICA,KwaZulu-Natal,Richards Bay,Windsurfing,M,Foot bruised & minor lacerations,N,"G. Cliff, NSB",feb
2469,1989.02.02,1989,Unprovoked,ITALY,Tyrrhenian Sea,"Golfo di Baratti, near Piombino (Tuscany)","Scuba diving, but swimming on surface",M,FATAL. His body not recovered,Y,"A. De Maddalena; Cappelletti (1989a), Bertuccelli (1989), Giudici & Fino (1989), Biagi (1989), Albertarelli (1989); I. Fergusson, MEDSA; C. Moore, GSAF",feb
