,Case Number,Year,Type,Country,Area,Location,Activity,Sex,Injury,Fatal,Source,Month
3612,1962.02.02,1962,Boat,NEW ZEALAND,North Island,South of New Plymouth,Fishing,,,UNKNOWN,SAF Case #1125,feb
3613,1962.02.00,1962,Unprovoked,SOLOMON ISLANDS,Guadalcanal Province,"North Coast, Guadalcanal Island",Swimming outside fishing net,M,"FATAL, shoulder & thigh bitten ",Y,"Auckland Herald, 2/26/1962",feb
3614,1962.01.27,1962,Unprovoked,NEW ZEALAND,South Island,Oreti Beach,Splashing ,M,"Left hand injured: gash on back of hand, toothmarks on palm",N,"R. Weeks, GSAF; V.M. Coppleson (1962), p.247; H. D. Baldridge, p.16",jan
3615,1962.01.26,1962,Unprovoked,MOZAMBIQUE,Gaza,Praia Sepulveda,,M,,UNKNOWN,D. Davies,jan
3616,1962.01.21,1962,Provoked,AUSTRALIA,New South Wales,Cronulla,Spearfishing,M,Suffered from shock & immersion after being dragged underwater  by speared shark PROVOKED INCIDENT,N,"Daily Mirror (Sydney) & Sydney Morning Herald, 1/22/1962 ",jan
3617,1962.01.18,1962,Invalid,SOUTH AFRICA,KwaZulu-Natal,Margate,"Fishing, slipped on rocks & fell into sea",M,Possible drowning / post mortem scavenging,Y,"D. Davies, p.114; A. Cowan, M. Levine, GSAF",jan
3618,1962.01.16,1962,Provoked,NEW ZEALAND,South Island,"Pigeon Bay, Canterbury",Fishing,,"No injury to occupants, hooked shark attacked boat PROVOKED INCIDENT",N,"The Sun (Australia), 1/17/1962",jan
3619,1962.01.15,1962,Unprovoked,NEW ZEALAND,North Island,"Slipper Island, Coromandel Peninsula",Spearfishing,M,Shark struck him on shoulder injuring skin under suit,N,"V.M. Coppleson (1962), p.254; H.D. Baldridge, p.1432",jan
3620,1962.01.14.c,1962,Unprovoked,USA,California,Farallon Islands,Spearfishing / Scuba diving (at surface),M,Buttock bitten & major leg wound,N,"D. Miller & R. Collier; R. Collier, pp.34-35; H.D. Baldridge, p.74; Clark, pp.98-99",jan
3621,1962.01.14.b,1962,Provoked,AUSTRALIA,New South Wales,"Long Reef, North Manly",Spearfishing,,Speared shark bit gunwale of boat as it was being hauled onboard PROVOKED INCIDENT,N,"Sydney Daily Telegraph, 1/15/1962 ",jan
3622,1962.01.14.a,1962,Unprovoked,AUSTRALIA,New South Wales,"Lennox Head, Ballina",Surfing,M,Dorsum of foot lacerated & toe severed,N,"The Star (Johannesburg), Daily Telegraph (Sydney), Sydney Morning Herald,  The Examiner (Launceston) 1/15/1962; V.M. Coppleson (1962), p.246; R.D. Weeks, GSAF",jan
3623,1962.01.11.c,1962,Boat,AUSTRALIA,South Australia,Marino,Fishing,,"No injury to occupant, shark bit propeller & lifted boat several feet",N,"Adelaide News, 1/12/1962",jan
3624,1962.01.11.b,1962,Unprovoked,PAPUA NEW GUINEA,"10ºS, 142ºE",Jukuataia Village,Spearfishing,M,Left leg & buttocks bitten,N,SAF Case #1193,jan
3625,1962.01.11.a,1962,Unprovoked,NEW ZEALAND,South Island,"Fairdown Beach, 5 miles north of Westport",Surf fishing,F,Right foot lacerated ,N,"R. D. Weeks, GSAF; Dr. C. Foote; The Evening Post, 1/12/1962 ",jan
3626,1962.01.10,1962,Boat,AUSTRALIA,South Australia,Ceduna,Fishing for sharks,,No injury to fisherman Alf Dean & other occupants; shark bit stern of boat,N,"Adelaide News, 1/10/1962",jan
3627,1962.01.08,1962,Invalid,AUSTRALIA,New South Wales,Lake Illawarra,Swimming,M,"Remains recovered from shark, but shark involvement prior to death unconfirmed",Y,"Canberra Times, 1/11/1962",jan
3628,1962.01.07.b,1962,Provoked,AUSTRALIA,Queensland,Dicky Beach,Rowing,,"No injury to occupants, shark bit 3"" piece from oar after they accidentally struck the shark PROVOKED INCIDENT",N,"Sydney Daily Telegraph, 1/8/1962 ",jan
3629,1962.01.07.a,1962,Unprovoked,AUSTRALIA,New South Wales,Sydney,Surfing,,"No injury, shark bumped board flipping him into the water",N,08/01/1962,jan
3630,1962.01.06,1962,Boat,SOUTH AFRICA,Western Cape Province,6 km off Groot Brak River,Fishing,,Shark rammed boat 5 times & holed it,N,T. Wallett,jan
3631,1962.01.02,1962,Provoked,AUSTRALIA,New South Wales,"Seaspray, near Sale",Fishing,,"No injury to occupants, hooked shark dragged boat 2 miles PROVOKED INCIDENT",N,"Sydney Daily Telegraph, 1/3/1962 ",jan
3632,1962.01.01,1962,Unprovoked,MARSHALL ISLANDS,Kwajalein Atoll,Roi-namur Island,Fishing with hand net in 2' of water,M,"2.5"" laceration on right hand",N,"L. R. Fletcher, M.D.",jan
3636,1961.12.28.c,1961,Unprovoked,AUSTRALIA,Queensland,"Lambert's Beach, Mackay",Standing,F,"FATAL, right arm severed at shoulder, left hand severed, right thigh bitten & surgically amputated.  Died  day after the attack",Y,"V.M. Coppleson (1962), p.246; A. MacCormick, pp.19-21; A. Sharpe, p.101 ",dec
3637,1961.12.28.b,1961,Unprovoked,AUSTRALIA,Queensland,"Lamberts Beach, Mackay",Standing,M,"Hand bitten, surgically amputated",N,"V.M. Coppleson (1962), p.246; A. MacCormick, pp.19-21; A. Sharpe, p.101",dec
3638,1961.12.28.a,1961,Unprovoked,SOUTH AFRICA,KwaZulu-Natal,Umhlanga Rocks,Treading water,M,Lower right leg & ankle bitten,N,"D.  Davies, pp.113-114; D. Davies & J. D'Aubrey; T. McDonnell, M. Levine, GSAF",dec
3639,1961.12.27,1961,Provoked,AUSTRALIA,Western Australia,"North of main swimming area in Waterman's Bay Beach, Perth",Spearfishing,M,"No injury, Parker shot the shark when it came close to his nephew, Bill Bradbury (14), then the shark bent his speargun PROVOKED INCIDENT",N,"The West Australia, 12/28/1961 ",dec
3640,1961.12.19,1961,Boat,AUSTRALIA,South Australia,Cowell,"Fishing, hauling in a 5-lb snapper",,No injury to occupant; shark leapt into boat,N,"Adelaide Advertiser, 12/20/1961",dec
3641,1961.12.18.b,1961,Unprovoked,MOZAMBIQUE,Gaza,Praia Sepulveda,Bathing,M,His left leg was severely bitten,N,Dr. C. d.  Nacimento,dec
3642,1961.12.18.a,1961,Unprovoked,AUSTRALIA,Queensland,Noosa Heads,"Surfing, pushing board ashore",M,"FATAL, right wrist and hand bitten, left leg severed above knee ",Y,"Natal Daily News, 12/19/1961; Sydney Morning Herald, 12/20/1961; V.M. Coppleson (1962), p.246; H.D. Baldridge, p.172; A. Sharpe, pp.100-101",dec
3643,1961.12.13,1961,Unprovoked,AUSTRALIA,Torres Strait,"Horn Island, near Thursday Island",Swimming with other crew near wharf,M,Right thigh and leg lacerated,N,"Brisbane Courier Mail, 12/14/1961; V.M. Coppleson (1962), p.246",dec
3644,1961.11.14,1961,Invalid,MEXICO,Guerrrero,Northwest of Acapulco,,,"Bodies of  hurricane victims bitten by shoals of sharks, post mortem scavenging",Y,"Sydney Daily Telegraph, 11/19/1961; SAF Case #1018",nov
3645,1961.10.27,1961,Unprovoked,PHILIPPINES,Western Luzon Island,Manila Bay,Gathering shells,M,Right leg severed,N,"Newcastle Morning Herald, 10/28/1961 ",oct
3646,1961.10.09,1961,Invalid,USA,Florida,"Ocean Ridge, Boca Raton, Palm Beach County",Swimming,M,"Skeletonized, but shark involvement may have occurred after death.",Y,"H.D. Baldridge, p.162",oct
3647,1961.10.00.b,1961,Boat,VANUATU,Shefa Province, Lelepa Island,Paddling outrigger canoe,M,"No injury to occupant, canoe  bitten & overturned by shark",N,"Pacific Islands Monthly, October 1961 ",oct
3648,1961.10.00.a,1961,Unprovoked,USA,Florida,"Boca Raton, Palm Beach County",,M,"FATAL. His body washed ashore, presumed shark attack",Y,"V.M. Coppleson (1962), p.249",oct
3649,1961.09.26,1961,Provoked,USA,Florida,"Florida Keys, Monroe County",,M,Foot & lower leg abraded and lacerated when he kicked the shark PROVOKED INCIDENT,N,H.D.Baldridge (1994) SAF Case #923,sep
3650,1961.09.24.b,1961,Unprovoked,CROATIA,Primorje-Gorski Kotar County ,"Opatija, northwestern coast of Rijeka Bay",Swimming,M,"FATAL, hand severed & legs bitten  ",Y,"The Mid-Ocean News, 9/28/1961; H.D. Baldridge, p.15; A. De Maddalena & C. Moore, GSAF;; Anon. (1961), Giudici & Fino (1989), Fergusson (1996)",sep
3651,1961.09.24.a,1961,Provoked,TANZANIA,,Near entrance to Dar-es-Salaam Harbour,Fishing,M,PROVOKED INCIDENT Right hand severed by hooked shark,N,Mombasa Times 9/25/1961,sep
3652,1961.09.23,1961,Unprovoked,MID ATLANTIC OCEAN,165  miles from Bermuda,,"Survived US Naval aircraft crash, climbing onboard rescue vessel when he fell back into sea ",M,Right shoulder blade  & back lacerated,N,"E.L.de Wilton; V.M. Coppleson (1962), p.246; H.D. Baldridge, p.102",sep
3653,1961.09.07,1961,Unprovoked,PERSIAN GULF,25 km off the coast of Iran & 483km from mouth of Persian Gulf,Khark Island,"Free diving, surveying a pipeline & examing cathodes under jetty",M,"3"" cut on sole of foot",N,"Underseas, Ltd (London)",sep
3654,1961.09.02.R,1961,Provoked,ITALY,Venice Province, Chioggia,Fishing,M,Left foot & right hand bitten by netted shark PROVOKED INCIDENT,N,"C. Moore, GSAF",sep
3655,1961.09.06,1961,Invalid,AUSTRALIA,Western Australia,Broome,Attaching a line at sea,,Shark involvement prior to death priunconfirmed,Y,"Canberra Times, 9/8/1962",sep
3656,1961.08.20,1961,Unprovoked,USA,California,"Portuguese Beach at mouth of Salmon Creek, Sonoma County",Swimming,M,"Foot, leg  & groin lacerated",N,"L.A. Times, 8/21/1961; D. Miller & R. Collier; R. Collier, p.33; V.M. Coppleson (1962), p.249; H.D. Baldridge, p.72",aug
3657,1961.08.16,1961,Unprovoked,USA,South Carolina,"Pawleys Island, Georgetown County",Wading,M,"Right arm bitten. Left leg bitten, surgically amputated ",N,C.O. Adams,aug
3658,1961.08.04,1961,Unprovoked,BERMUDA,,6 miles from shore,Spearfishing,M,Right hand lacerated,N,"R. McAllister; H.D. Baldridge, p.134",aug
3659,1961.08.02,1961,Unprovoked,USA,Hawaii,"Pearl Harbor Channel, O'ahu","Net fishing, picking catch from the net",M,Hand bitten,N,"K. Kato; V.M. Coppleson (1962), p.246",aug
3660,1961.08.01,1961,Provoked,PAPUA NEW GUINEA,Sandaun Province,Vanimo  on Musu side of Wutong anchorage,"Fishing, two large sharks passed. He speared one and it bit him",M,Thigh lacerated PROVOKED INCIDENT,N,"A.M. Rapson, p.147",aug
3661,1961.07.29,1961,Provoked,USA,New York,Whitewood Point on Lloyd Neck in Oyster Bay,Spearfishing,M,Puncture wound on right shin & fingers lacerated by speared shark PROVOKED INCIDENT,N,B. Junker,jul
3662,1961.07.16,1971,Unprovoked,TURKEY,Anatolia,"?nciralti Beach, ?zmir ",Swimming,M,Left leg injured,N,"C. Moore, GSAF",jul
3663,1961.07.07.b,1961,Provoked,AUSTRALIA,Queensland,Cape Moreton,Shark fishing,,"No injury to occupant, hooked shark bit boat's rudder PROVOKED INCIDENT",N,"Brisbane Courier-Mail, 7/10/1961; SAF Case #894",jul
3664,1961.07.00.b,1961,Unprovoked,ITALY,Adriatic Sea,Riccione,Spearfishing,M,Foot bitten,N,"M. Gregor; H.D. Baldridge, p.135; A. De Maddalena; Ellis (1973), Fergusson (1996), Mojetta et al. (1997)",jul
3665,1961.07.00.a,1961,Provoked,PANAMA,,"Jarque, just south of Pi?as Bay",Fishing (trolling)  from canoe,M,"FATAL, hooked shark pulled him into the water PROVOKED INCIDENT",Y,"J. Hardie, D. DeSylva",jul
3666,1961.06.24,1961,Unprovoked,USA,Florida,"500 yards from Fowey Rock Light, 9 miles east of Key Biscayne, Miami",Scuba diving & spearfishing ,M,"FATAL, arm severed & left side of torso removed ",Y,"D. McGee, J. Quillian, W. M. Stephens; V.M. Coppleson (1962), p.249; H.D. Baldridge, p.183",jun
3667,1961.06.18,1961,Unprovoked,USA,Florida,"Jensen Beach, Martin County",Standing,M,Lacerations to left leg,N,"News Tribune, 6/20/1961",jun
3668,1961.06.06.R,1961,Boat,USA,Florida,"Ponte Vedra Beach, St. Johns County",Spearfishing on Scuba,M,"No injury to diver or occupants of the boat, shark butted boat ",N,"Florida Times-Union, 6/6/1961 ",jun
3669,1961.06.02,1961,Unprovoked,NEW BRITAIN,East New Britain Province,Rabaul,Spearfishing,M,Minor injuries to arm,N,"A.M. Rapson, p.150",jun
3670,1961.06.01,1961,Provoked,PAPUA NEW GUINEA,"Admiralty Islands, Manus Province","Rossun, Manus","Fishing, speared shark upset canoe & man fell in water",M,"Left thigh severely bitten, but he regained  the canoe, then shark bit canoe PROVOKED INCIDENT",N,"J. McDonough; A. M. Rapson, p.147; Papua and New Guinea Agricultural Journal;",jun
3671,1961.05.21,1961,Unprovoked,USA,California,"Tomales Point, Marin County",Free diving for abalone,M,"No injury, wetsuit bitten",N,"D. Miller & R. Collier; R. Collier, pp.32-33 ",may
3672,1961.05.17,1961,Unprovoked,NEW BRITAIN,East New Britain Province,Kokopo,Collecting dynamited fish,M,Thumb & 2 fingers severed,N,"A.M. Rapson, p. 150]",may
3673,1961.05.15,1961,Unprovoked,USA,Florida,"Laguna Beach, Bay County",Walking in chest-deep water,M,Middle finger of left hand & right forearm lacerated,N,"G.L. Morris; Post Herald (Birmingham, Alabama) 5/18/1961; V.M. Coppleson (1962), p.249",may
3674,1961.05.07,1961,Provoked,AUSTRALIA,Western Australia,"Quinns Rocks, south of Yanchep",Spearfishing,M,"No injury, speared shark hit speargun PROVOKED INCIDENT",N,"The West Australian (Perth), 5/8/1961 ",may
3675,1961.04.30,1961,Invalid,USA,Florida,Palm Beach County,Splashing ,M,Abdomen abraded,N,H.D.Baldridge (1994) SAF Case #942,apr
3676,1961.04.25,1961,Provoked,AUSTRALIA,New South Wales,"Trial Bay, north of Kempsey",Spearfishing,M,Speared shark bit Davy's ankle &  Pierpont's right leg  PROVOKED INCIDENT,N,"Kempsey Macleay Argus (N.S.W.), 4/27/1961",apr
3677,1961.04.21,1961,Unprovoked,MOZAMBIQUE,Gaza,"Sepulveda Beach, Xai Xai",Swimming,M,"Multiple injuries to both hands, left leg & foot",N,"D. Davies, pp.125-126; M. Levine,GSAF; Star, 4/23/1961",apr
3678,1961.04.17,1961,Provoked,SOUTH AFRICA,Eastern Cape Province,Port Elizabeth Oceanarium,Diving,M,Shark bit swimfin after diver kicked shark PROVOKED INCIDENT,N,"G. Ross, M. Levine, GSAF",apr
3679,1961.04.16.b,1961,Unprovoked,USA,Florida,"Fowey Rock Light, Miami",Spearfishing,M,Thigh bitten,N,"W. M. Stephens; H.D. Baldridge, p.166; Clark, p.102 ",apr
3680,1961.04.16.a,1961,Provoked,AUSTRALIA,New South Wales,Otford,Spearfishing,M,Speared shark bit his foot  PROVOKED INCIDENT,N,"Sydney Morning Herald, 4/17/1961; G. P. Whitley; Perth Daily News, 4/19/1961;  V.M. Coppleson (1962), p.252; H.D. Baldridge, p.165",apr
3681,1961.04.14,1961,Unprovoked,AUSTRALIA,New South Wales,10 miles off Nambucca Heads  onboard trawler,"Checking fish traps, fell into the water",M,Tiny cuts & bruises on neck  ,N,"G. P. Whiltley citing Sydney Morning Herald, 4/15/1961 & 4/17/1961",apr
3682,1961.04.09,1961,Unprovoked,MOZAMBIQUE,Gaza,Xai Xai,"Swimming, using bundles of sticks as raft",M,"FATAL, extensive abdominal wounds, died 4 days later  ",Y,"D. Davies, p.125; Star, 4/14/1961",apr
3683,1961.04.08,1961,Sea Disaster,PERSIAN GULF,United Arab Emirates,Dubai,Cargo ship Dara sank after collision with another ship during a severe storm,,Some of the survivors said to have been bitten by sharks,Y,"V.M. Coppleson (1962), p.260",apr
3684,1961.04.03,1961,Unprovoked,AUSTRALIA,Victoria,Flinders Island,Spearfishing,M,"No injury, right sleeve of wetsuit ripped, weight on belt gashed",N,"Sydney Morning Herald, 4/4/1961 ; Launceston Examiner; H.D. Baldridge, pp.133-134",apr
3685,1961.04.00,1961,Provoked,AUSTRALIA,Western Australia,Rottnest Island,Spearfishing,M,Speared shark bit his arm & seat of pants of diving suit  PROVOKED INCIDENT,N,"Perth Daily News, 4/19/1961",apr
3686,1961.03.30,1961,Unprovoked,AUSTRALIA,South Australia,Glenelg Breakwater,Spearfishing,M,"Shark took his entire catch, lacerated his knee and tore his wet suit as it brushed past him",N,"G.P. Whitley citing Sydney Morning Herald, 4/1/1961; V.M. Coppleson (1962), p.252 ",mar
3687,1961.03.18,1961,Unprovoked,AUSTRALIA,Victoria,Lady Beach at Warrnambool,Swimming,M,"Abdomen & arm bitten. Shark, holding him by the arm, leapt 4' to 5' above the surface",N,"Sun Herald (Sydney) 3/19/1961; Sydney Morning Herald, 3/20/1961; V.M. Coppleson (1962), p.246",mar
3688,1961.03.14,1961,Provoked,AUSTRALIA,Western Australia,Shark Bay,Fishing from dinghy,F,Hooked shark hauled on board bit her foot PROVOKED INCIDENT,N,"Sydney Daily Telegraph, no date; L. Schultz & M. Malin, p.548",mar
3689,1961.03.12,1961,Unprovoked,AUSTRALIA,South Australia,Aldinga Beach,Spearfishing,M,Left leg bitten  & left forearm lacerated,N,"V.M. Coppleson (1962), pp.182 & 252; H. Edwards, pp.61-63; H.D. Baldridge, p.56; J. West, ASAF",mar
3690,1961.03.09,1961,Unprovoked,NORTH PACIFIC OCEAN,Wake Island (EnenKio),"Leeward side of island, directly in back of Mid-Pac barrel storage area",Free diving,M,Right elbow bitten,N,"J.K. Stewart; Albert Tester; V.M. Coppleson (1962), p.254; H.D. Baldridge, p.207",mar
3691,1961.03.07,1961,Provoked,SOUTH AFRICA,KwaZulu-Natal,St. Lucia,Fishing,M,Landed shark in boat bit his left leg  PROVOKED INCIDENT,N,"GSAF; D. Davies, pp.112-113",mar
3692,1961.03.00,1961,Unprovoked,FIJI,"19S, 178?E","Wotua Beach, 70 miles from Suva",Floating on back,M,Right forearm bitten,N,A. Bailey,mar
3693,1961.02.17.b,1961,Provoked,USA,Pennsylvania,"Fairmount Park Aquarium, Philadelphia",Cleaning a tank,M,Thumb lacerated by captive shark PROVOKED INCIDENT,N,"The Bee, 2/18/1961",feb
3694,1961.02.17.a,1961,Unprovoked,AUSTRALIA,Victoria,Mount Martha Beach,Standing,F,"Ankle bitten by small gummy shark, minor injury",N,"Morning Peninsular Post (Victoria, Australia), 2/22/1961; V.M. Coppleson (1962), p.246",feb
3695,1961.02.16,1961,Unprovoked,JAMAICA,,,,M,FATAL,Y,"E. C. Raney; V.M. Coppleson (1962), p.247 ",feb
3697,1961.02.01.b,1961,Unprovoked,SOUTH AFRICA,Eastern Cape Province,Nahoon,Swimming,M,"FATAL, multiple injuries to both legs, feet & left arm  ",Y,"D. Davies & J. D'Aubrey;  D. Davies, pp.122-124; M. Levine, GSAF",feb
3698,1961.02.01.a,1961,Unprovoked,AUSTRALIA,Western Australia,Carnac Island,Collecting crayfish,M,No injury,N,"H.D. Baldridge, p.134",feb
3699,1961.02.00,1961,Invalid,USA,California,"Topanga Canyon Beach, Santa Monica Bay",,M,Considered a doubtful incident,N,"R. Collier, G.. Helfman",feb
3700,1961.01.25,1961,Boat,SOUTH AFRICA,Western Cape Province,Frikkies Bay,Fishing for kob,,"No injury to occupants, shark took a gaffed fish they were bringing aboard & hit their boat",N,"Cape Times, 1/27/1961; SAF Case #945",jan
3701,1961.01.22,1961,Unprovoked,SOUTH AFRICA,KwaZulu-Natal,Amanzimtoti,Swimming,M,Left thigh bitten ,N,"M. Murphy, M. Levine, GSAF; A.C. Copley; G. D. Campbell;  D. Davies, pp.111-112",jan
3702,1961.01.15,1961,Provoked,AUSTRALIA,New South Wales,Cook Island,Collecting aquarium specimens,M,Right calf  bitten by lassoed shark on deck of surf ski PROVOKED INCIDENT,N,"Mackay Daily Mercury (Queensland), 1/16/196; H.D. Baldridge, p.134",jan
3703,1961.01.06.c,1961,Unprovoked,SOUTH AFRICA,KwaZulu-Natal,Winkelspruit,Standing,M,"Right foot, leg and hand bitten",N,"GSAF;  D. Davies & J. D'Aubrey; D. Davies, pp.109-111",jan
3704,1961.01.06.b,1961,Sea Disaster,ATLANTIC OCEAN,9.35N 79.35W,"East of La Grande Island, North of Panama Canal",Pacific Seafarer of US Navy,,"3 were lost, 3 survived",Y,"C.R. Wolf, M.D.",jan
3705,1961.01.06.a,1961,Provoked,AUSTRALIA,Northern Territory,"Stokes Hill Wharf, Darwin",Fishing,M,Finger bitten by hooked shark PROVOKED INCIDENT,N,"Darwin Northern Territory News, 1/10/1961",jan
3706,1961.01.05,1961,Unprovoked,MOZAMBIQUE,Limpopo River,190 km to 240 km from the sea,Swimming,M,Leg bitten ,N,"D. Davies, p.124-125",jan
3707,1961.01.03.b,1961,Unprovoked,SOUTH AFRICA,Western Cape Province,Strandfontein,Standing,M,"Lower left leg bitten, abrasions on back of right leg",N,"Cape Times, 1/4/1961, M. Levine, GSAF",jan
3708,1961.01.03.a,1961,Invalid,SOUTH AFRICA,KwaZulu-Natal,Palm Beach,,,Human remains (patella & remnants of black swim suit) found in shark,Y,"D. Davies; M. Levine, GSAF",jan
3709,1961.01.02.R,1961,Boat,AUSTRALIA,Tasmania,Off Tasman Island,Ocean racing,,"No injury to occupants, shark struck boat",N,C. Black. GSAF,jan
3711,1961.01.01,1961,Unprovoked,COLUMBIA,Roncador Bank,"Roncador Bank, 135 nm north of San Andres ",Taking boat from California to Florida when it ran aground & he was swimming back to boat,M,Leg bitten,N,V.M. Coppleson (1962) p.246,jan
3715,1960.12.27.b,1960,Unprovoked,USA,Hawaii,"Maile Point, O'ahu",Swept out to sea while net fishing,M,"FATAL  Shark seen attacking Riley, body recovered off Nanakuli",Y,"L. Taylor (1993), pp.100-101",dec
3716,1960.12.27.a.,1960,Unprovoked,AUSTRALIA,New South Wales,"Bondi Beach, Sydney",,F,"Shark brushed past, minor injuries if any",N,"Baltimore Sun, 12/28/1960; Sydney Morning Herald 12/28/1960; V.M. Coppleson (1962), p.246; J. Green, p.35",dec
3717,1960.12.24,1960,Unprovoked,SOUTH AFRICA,KwaZulu-Natal,Margate,Swimming,M,"FATAL, legs severed ",Y,"D. Davies & J. D'Aubrey; D. Davies, pp. 108-109; T. Wallett; M. Levine, GSAF",dec
3718,1960.12.20,1960,Unprovoked,AUSTRALIA,Queensland,"Colleges Crossing, 54 miles above mouth of the Brisbane River","Fishing, when line became snagged on rock & he dived into water to free it ",M,Left thigh lacerated,N,"Sydney Morning Herald, 12/21/1960; V.M. Coppleson (1962), p.246 ",dec
3719,1960.12.01,1960,Unprovoked,AUSTRALIA,Queensland,"Colledge's Crossing, Brisbane River",Fishing,M,Bitten & survived,N,"Sunday Mail, 3/27/1994, p.107",dec
3720,1960.11.27,1960,Unprovoked,AUSTRALIA,Queensland,"Blacks Beach, 9 miles north of Mackay",Swimming,M,Right shoulder lacerated,N,"Daily Mercury (Mackay), 11/28/1960 ",nov
3721,1960.11.22,1960,Invalid,USA,Florida,"Hutchinson Island Beach, Martin County","Fell overboard, prop slashed arm",F,"FATAL, probable drowning & post mortem scavenging",Y,"News-Tribune (Fort Pierce, FL], 11/27/1960; SAF Case #803",nov
3722,1960.11.11,1960,Provoked,AUSTRALIA,Queensland,"Scotts Point, Redcliffe Peninsula",Chasing shark out of bathing area while riding on a surf-ski,M,"Shark knocked him off surf-ski, he inhaled water & had to be resuscitated PROVOKED INCIDENT",N,"Courier-Mail (Queensland), 11/12/1960; L. Schultz & M. Malin, p.547 ",nov
3723,1960.11.06,1960,Unprovoked,AUSTRALIA,Western Australia,Hamelin Bay,"Spearfishing, speared fish retreated to cave where shark grabbed his arm",M,Scratches on right upper arm,N,"The West Australian (Perth), 11/7/1960;   V.M. Coppleson (1962), p.252 ",nov
3724,1960.11.00.d,1960,Boat,SOUTH AFRICA,Western Cape Province,"5 km from Gordons Bay, False Bay",Hand lining for shad,,"No injury to occupants, shark bit 45 cm hole in hull",N,"D. Davies; T. Wallett, p.27-30",nov
3725,1960.11.00.c,1960,Provoked,NEW GUINEA,Western District,Toro Passage,,M,Left wrist bitten by netted shark placed in bottom of dinghy PROVOKED INCIDENT,N,"A.M. Rapson, p.147",nov
3726,1960.11.00.b,1960,Unprovoked,PAPUA NEW GUINEA,Central Province,Abau Subdistrict,Fishing,M,"FATAL, severely bitten genitals & thighs ",Y,"A. Bleakley; A.M. Rapson, p.150 ",nov
3727,1960.10.25,1960,Sea Disaster,USA,California,"Off Point Mugu, Ventura County",Ejected from F3H-2 aircraft ,M,"No injury, shark hit his foot & circled",N,"US Naval Aviation Safety Center; L. Schultz & M. Malin, p.562",oct
3728,1960.10.24,1960,Boat,SOUTH AFRICA,Western Cape Province,"Jacobs Bay Reef, Saldanha Bay",Fishing for rock lobsters,,"No injury to occupants, shark rammed & bit  boat",N," D. Davies, p.185; Natal Daily News, 10/25/1960; Natal Witness, 10/26/1960",oct
3729,1960.10.02,1960,Invalid,AUSTRALIA,New South Wales,North Head,Fishing,M,"Swept off rocks & presumed to have drowned, shark seen in area",N,"Letter from L. Schultz to G. P. Whitley, dated 2/24/1961",oct
3730,1960.10.00.e,1960,Unprovoked,PAPUA NEW GUINEA,New Britain,"East Nakanai, Talasea",Collecting shells,M,Injuries to leg & foot,N,"A.M. Rapson, p.149",oct
3731,1960.10.00.d,1960,Sea Disaster,RED SEA / INDIAN OCEAN,Enroute from Suez to Aden (Yemen),,Cargo ship El Gamil entroute Suez to Yemen (Aden) when her cargo shifted and she sank. 19 Egyption sailors jumped into the water and swam for several hours before being bitten by sharks,M,"Sharks attacked sailors in the water, several survivors picked up",Y,"V.M. Coppleson (1962), p.260",oct
3732,1960.10.00.c,1960,Invalid,USA,Florida,Haulover Inlet,Diving,M,"Apparently went missing while diving. Helicopter searching for him spotted school of sharks attacking a ""white object"" 15' below the surface",Y,"Miami Herald, 10/18/1960",oct
3733,1960.10.00.b,1960,Boat,SOUTH AFRICA,Western Cape Province,False Bay,Fishing,,"Shark rammed boat, breaching its hull",N,T. Wallett,oct
3734,1960.10.00.a,1960,Invalid,JOHNSTON ISLAND,,,"Free diving / photography, kneeling on sand",M,"No injury, shark made threat display",N,R. McAllister; SAF Case #958,oct
3735,1960.09.24,1960,Provoked,USA,South Carolina,"Atlantic Beach, Horry County",Fishing inside net,M,"Multiple superficial lacerations of leg, arm & hand PROVOKED INCIDENT",N,"News (Lancaster, SC), 10/3/1960; H.D. Baldridge, p.142",sep
3736,1960.09.22,1960,Sea Disaster,PACIFIC OCEAN,180 miles southeast of Okinawa,,R5D aircraft went down with 29 on board,M,One body sighted but not recovered due to shark activity,N,"US Naval Aviation Safety Center; L. Schultz & M. Malin, p.562",sep
3737,1960.09.18,1960,Boat,AUSTRALIA,Western Australia,Frenchman Bay,,,"No injury to occupants, toothmarks on bottom & side of dinghy",N,P.W. Gilbert,sep
3738,1960.09.02,1960,Invalid,MARSHALL ISLANDS,Eniwetok Atoll,Lagoon along Sand Island,Free diving / Spearfishing,M,"No injury, shark made a threat display",N,E.S. Hobson; SAF Case #955,sep
3739,1960.09.01,1960,Invalid,MARSHALL ISLANDS,Eniwetok Atoll,Parry Island,Free diving / Spearfishing,M,"No injury, shark made a threat display",N,E.S. Hobson; SAF Case #954,sep
3740,1960.08.30,1960,Unprovoked,USA,New Jersey,"Ocean City, Cape May County",Swimming 3 miles offshore,M,Right leg severely lacerated,N,"R. Chung; Dr. Godfrey; V.M. Coppleson (1962), p.249;   R. Skocik, p.172",aug
3741,1960.08.29,1960,Sea Disaster,SENEGAL,Cap-Vert Peninsula,off Dakar,Air disaster: crash of Air France Super Constellation ,,All 63 on board perished when the aircraft hit the water. Sharks hampered retrieval of bodies,Y,"The Daily Telegram (Colombus, 8/30/1960, p.3",aug
3742,1960.08.25,1960,Invalid,USA,Texas,30 miles east of Corpus Christi,Aircraft crashed into sea,M,"Partial human remains spotted by helicopter, shark involvement, if any, may have been post-mortum",Y,"US Naval  Aviation Safety Center; L. Schultz & M. Malin, p.558; SAF Case #1013",aug
3743,1960.08.24,1960,Unprovoked,USA,Connecticut,"Off Eames Monument, Bridgeport, Fairfield County",Free diving,M,Superficial laceration of left arm,N,M. McMahon,aug
